{
 "id": "M-173",
 "target": "hexside",
 "key": "C3921|C4020",
 "before": {
  "key": "C3921|C4020",
  "a": "C3921",
  "b": "C4020",
  "side": null,
  "features": [
   "railroad"
  ],
  "up": null
 },
 "patches": [
  {
   "op": "replace",
   "path": "/features",
   "value": [
    "track",
    "unfinished-railroad"
   ]
  }
 ],
 "seen": {
  "scan": "scan:p189",
  "crop": [
   1767,
   1860,
   220,
   180
  ],
  "note": "a dashed track crosses this hexside on the scan alongside the feature already read (on the redraw its 1 px dashes run beside the heavier symbol and the extractor did not read them)"
 },
 "superseded": false
}
