{
 "id": "M-319",
 "target": "hexside",
 "key": "A4832|A4933",
 "before": {
  "key": "A4832|A4933",
  "a": "A4832",
  "b": "A4933",
  "side": null,
  "features": [
   "railroad"
  ],
  "up": null
 },
 "patches": [
  {
   "op": "replace",
   "path": "/features",
   "value": [
    "railroad",
    "track"
   ]
  }
 ],
 "seen": {
  "scan": "scan:p187",
  "crop": [
   5969,
   2291,
   441,
   360
  ],
  "note": "the railway (blue with ties) and the dashed track that runs beside it both cross this hexside"
 },
 "superseded": false
}
