{
 "id": "M-282",
 "target": "hexside",
 "key": "A2331|A2332",
 "before": null,
 "patches": [
  {
   "op": "add",
   "path": "",
   "value": {
    "key": "A2331|A2332",
    "a": "A2331",
    "b": "A2332",
    "side": null,
    "features": [
     "track"
    ],
    "up": null
   }
  }
 ],
 "seen": {
  "scan": "scan:p187",
  "crop": [
   5733,
   6422,
   441,
   360
  ],
  "note": "a dashed track crosses this hexside on the scan (and on the redraw, whose 1 px dashes the extractor did not read)"
 },
 "superseded": false
}
