{
 "id": "M-479",
 "target": "hexside",
 "key": "D1130|D1229",
 "before": null,
 "patches": [
  {
   "op": "add",
   "path": "",
   "value": {
    "key": "D1130|D1229",
    "a": "D1130",
    "b": "D1229",
    "side": null,
    "features": [
     "track"
    ],
    "up": null
   }
  }
 ],
 "seen": {
  "scan": "scan:p190",
  "crop": [
   2650,
   4155,
   220,
   180
  ],
  "note": "a dashed track crosses this hexside on the scan (and on the redraw, whose 1 px dashes the extractor did not read)"
 },
 "superseded": false
}
