{
 "id": "M-130",
 "target": "hexside",
 "key": "C2410|C2411",
 "before": null,
 "patches": [
  {
   "op": "add",
   "path": "",
   "value": {
    "key": "C2410|C2411",
    "a": "C2410",
    "b": "C2411",
    "side": null,
    "features": [
     "track"
    ],
    "up": null
   }
  }
 ],
 "seen": {
  "scan": "scan:p189",
  "crop": [
   851,
   3116,
   220,
   180
  ],
  "note": "a dashed track crosses this hexside on the scan (and on the redraw, whose 1 px dashes the extractor did not read)"
 },
 "superseded": false
}
