{
 "id": "M-463",
 "target": "hexside",
 "key": "B5807|B5908",
 "before": null,
 "patches": [
  {
   "op": "add",
   "path": "",
   "value": {
    "key": "B5807|B5908",
    "a": "B5807",
    "b": "B5908",
    "side": null,
    "features": [
     "slope"
    ],
    "up": "B5807"
   }
  }
 ],
 "seen": {
  "scan": "scan:p188",
  "crop": [
   586,
   345,
   218,
   179
  ],
  "note": "the hachured slope band of the coastal escarpment lies along this hexside on the seaward hex (band on the down side), so the inland hex is up"
 },
 "superseded": false
}
