{
 "id": "M-860",
 "target": "hexside",
 "key": "E0814|E0815",
 "before": null,
 "patches": [
  {
   "op": "add",
   "path": "",
   "value": {
    "key": "E0814|E0815",
    "a": "E0814",
    "b": "E0815",
    "side": null,
    "features": [
     "ridge"
    ],
    "up": null
   }
  }
 ],
 "seen": {
  "scan": "scan:p191",
  "crop": [
   1252,
   4410,
   222,
   178
  ],
  "note": "the hachured hill band is printed on both sides of this hexside on the scan (the band straddles the hexside), which the extraction reads as ridge"
 },
 "superseded": false
}
