{
 "id": "M-652",
 "target": "hexside",
 "key": "E1107|E1206",
 "before": null,
 "patches": [
  {
   "op": "add",
   "path": "",
   "value": {
    "key": "E1107|E1206",
    "a": "E1107",
    "b": "E1206",
    "side": null,
    "features": [
     "track"
    ],
    "up": null
   }
  }
 ],
 "seen": {
  "scan": "scan:p191",
  "crop": [
   472,
   4124,
   221,
   180
  ],
  "note": "a dashed track crosses this hexside on the scan (and on the redraw, whose 1 px dashes the extractor did not read)"
 },
 "superseded": false
}
