{
 "id": "M-929",
 "target": "hexside",
 "key": "D2233|NE",
 "before": {
  "key": "D2233|NE",
  "a": "D2233",
  "b": null,
  "side": "NE",
  "features": [
   "escarpment"
  ],
  "up": null
 },
 "patches": [
  {
   "op": "replace",
   "path": "/up",
   "value": "E2301"
  }
 ],
 "seen": {
  "scan": "scan:p190",
  "crop": [
   2963,
   3245,
   300,
   300
  ],
  "note": "Sheet-edge escarpment D2233|NE - E2301|SW: the band is drawn on D2233's side, inside D2233's hex with its ragged splash edge towards that hex's centre and its solid edge on the hexside (redraw band read, scan page of D checked); the band is on the down side (EXTRACTION.md, Map C up-side convention), so E2301 is up"
 },
 "superseded": false
}
