{
 "id": "M-355",
 "target": "hexside",
 "key": "B0413|B0414",
 "before": null,
 "patches": [
  {
   "op": "add",
   "path": "",
   "value": {
    "key": "B0413|B0414",
    "a": "B0413",
    "b": "B0414",
    "side": null,
    "features": [
     "track"
    ],
    "up": null
   }
  }
 ],
 "seen": {
  "scan": "scan:p188",
  "crop": [
   1171,
   4733,
   218,
   179
  ],
  "note": "a dashed track crosses this hexside on the scan (and on the redraw, whose 1 px dashes the extractor did not read)"
 },
 "superseded": false
}
