{
 "id": "M-669",
 "target": "hexside",
 "key": "E1431|E1432",
 "before": {
  "key": "E1431|E1432",
  "a": "E1431",
  "b": "E1432",
  "side": null,
  "features": [
   "track"
  ],
  "up": null
 },
 "patches": [
  {
   "op": "remove",
   "path": ""
  }
 ],
 "seen": {
  "scan": "scan:p191",
  "crop": [
   2859,
   3922,
   221,
   180
  ],
  "note": "no track crosses this hexside on the scan; the extractor read the letter strokes of the printed place name 'Helwan' as track dashes"
 },
 "superseded": false
}
