{
 "id": "M-713",
 "target": "hexside",
 "key": "B4906|B4907",
 "before": {
  "key": "B4906|B4907",
  "a": "B4906",
  "b": "B4907",
  "side": null,
  "features": [
   "wadi"
  ],
  "up": null
 },
 "patches": [
  {
   "op": "replace",
   "path": "/features",
   "value": [
    "track",
    "wadi"
   ]
  }
 ],
 "seen": {
  "scan": "scan:p188",
  "crop": [
   470,
   1112,
   219,
   177
  ],
  "note": "a dashed track crosses this hexside on the scan alongside the feature already read (on the redraw its 1 px dashes run beside the heavier symbol and the extractor did not read them)"
 },
 "superseded": false
}
