{
 "id": "M-551",
 "target": "hexside",
 "key": "D3502|D3602",
 "before": {
  "key": "D3502|D3602",
  "a": "D3502",
  "b": "D3602",
  "side": null,
  "features": [
   "slope"
  ],
  "up": "D3502"
 },
 "patches": [
  {
   "op": "replace",
   "path": "/features",
   "value": [
    "slope",
    "track"
   ]
  }
 ],
 "seen": {
  "scan": "scan:p190",
  "crop": [
   65,
   2211,
   220,
   180
  ],
  "note": "a dashed track crosses this hexside on the scan alongside the feature already read (on the redraw its 1 px dashes run beside the heavier band and the extractor did not read them)"
 },
 "superseded": false
}
